{
  "schema_version": "1.0",
  "kind": "command-evidence",
  "id": "synthetic-example",
  "command_id": "synthetic-example",
  "argv_redacted": [
    "synthetic-example"
  ],
  "cwd_worktree_id": "synthetic-example",
  "cwd_relative": "synthetic-example",
  "started_at": "2026-09-05T00:00:00Z",
  "finished_at": null,
  "exit_code": null,
  "status": "launch_failed",
  "stdout_ref": null,
  "stderr_ref": null,
  "redactions_applied": false,
  "output_truncated": false,
  "environment_binding_names": [],
  "error_category": null
}
